{
  "eventId": "listing.published.ad_post.123.20260521120000",
  "eventType": "listing.published",
  "eventVersion": 1,
  "occurredAt": "2026-05-21T12:00:00Z",
  "sourceSystem": "bornado-wordpress",
  "idempotencyKey": "listing-published-123-v1",
  "locale": "fa-IR",
  "payload": {
    "user": {
      "id": "wp-user-42",
      "externalId": "42",
      "displayName": "کاربر نمونه",
      "email": "user@example.com",
      "phone": "+989121234567",
      "phoneVerified": true,
      "profileUrl": "https://example.com/profile/",
      "channelCapabilities": {
        "whatsapp": null,
        "sms": true,
        "email": true
      },
      "contacts": [
        {
          "channel": "whatsapp",
          "address": "+989121234567",
          "verified": true,
          "primary": true,
          "priority": 10,
          "capabilities": {
            "whatsapp": "unknown",
            "transactional": true
          }
        },
        {
          "channel": "sms",
          "address": "+989121234567",
          "verified": true,
          "primary": true,
          "priority": 20,
          "capabilities": {
            "sms": true,
            "transactional": true
          }
        },
        {
          "channel": "email",
          "address": "user@example.com",
          "verified": true,
          "primary": false,
          "priority": 30,
          "capabilities": {
            "email": true,
            "transactional": true
          }
        }
      ]
    },
    "listing": {
      "id": "wp-post-123",
      "externalId": "123",
      "title": "فروش آپارتمان ۱۲۰ متری",
      "status": "publish",
      "url": "https://example.com/listing/123",
      "editUrl": "https://example.com/post-ad/?id=123",
      "manageUrl": "https://example.com/profile/?page_type=my_ads",
      "deleteUrl": "https://example.com/profile/?page_type=my_ads"
    }
  }
}
